{"authority":{"benchmark_overlap":"unknown","evidence_classification":"internal-descriptive-only","formal_claims":"none","production_evidence":false,"public_distribution":false,"quality_gate_status":"not-assessed"},"dataset":{"dataset_card":{"repository_path":"README.md","sha256":"688f79f2a5c731af3796e9f683eb02f9b3f09d040decd8c5625d0f37098e71c6","size_bytes":385614},"dataset_id":"google/fleurs","revision":"70bb2e84b976b7e960aa89f1c648e09c59f894dd","split":"test"},"kind":"meetingrelay-fleurs-gold-source-policy-v1","rights":{"allowed_purpose":"asr-quality-component-measurement","attribution_required":true,"attribution_url":"https://huggingface.co/datasets/google/fleurs","change_notice_required":true,"citation_url":"https://arxiv.org/abs/2205.12446","consent_clearance":"upstream-undocumented","decision_scope":"engineering-policy-not-legal-advice","decision_status":"approved-with-conditions","legal_review":"not-performed","license":"CC-BY-4.0","license_url":"https://creativecommons.org/licenses/by/4.0/","public_distribution":false},"schema_version":"1.0","selection":{"common_id_count":320,"filename_tie_breaker":"sha256-utf8-lexicographic-ascending","selected_utterance_count":960},"source_contract_status":"frozen-source-readiness","sources":[{"config":"en_us","language":"en","test_archive":{"lfs_sha256":"d9c2e37b41aacd41bc283554a0a82b5476b36887049774ecb2819dcaaa55a356","repository_path":"data/en_us/audio/test.tar.gz","size_bytes":289851356},"test_tsv":{"repository_path":"data/en_us/test.tsv","row_count":647,"sha256":"74c046239374deeb60fa63f258f907388093a32bcaa3140965f70ef05c79f7ca","size_bytes":367864}},{"config":"ja_jp","language":"ja","test_archive":{"lfs_sha256":"5de465fa7aaafc4e2c13aba44771550b8cd2dd29bb9b265daeb6d92ca8e0c136","repository_path":"data/ja_jp/audio/test.tar.gz","size_bytes":448762391},"test_tsv":{"repository_path":"data/ja_jp/test.tsv","row_count":650,"sha256":"5dd9643511437414681ad3f23508596c621cdf78978724a09f1f06fefe9d300b","size_bytes":361174}},{"config":"cmn_hans_cn","language":"zh","test_archive":{"lfs_sha256":"09d19ad18f5d7e91076880807e866cd16abd924c7052b55f71cdae91714fc166","repository_path":"data/cmn_hans_cn/audio/test.tar.gz","size_bytes":525346466},"test_tsv":{"repository_path":"data/cmn_hans_cn/test.tsv","row_count":945,"sha256":"5734461648f816181d7dab5fc79204b18c4b9bc2cd5138225b25c72d18385d21","size_bytes":491487}}]}
